{
  "camera": {
    "aperture_f": 11.0,
    "extents": [
      -3.200000047683716,
      3.200000047683716,
      -1.7999999523162842,
      1.7999999523162842,
      0.10000000149011612,
      100.0
    ],
    "fit_to_view": true,
    "iso": 100.0,
    "position": [
      1.1793500185012817,
      3.798417091369629,
      5.532724380493164
    ],
    "rotation": [
      0.13728313148021698,
      0.05245884507894516,
      0.3530730605125427,
      0.9239810705184937
    ],
    "shutter_rate": 125.0
  },
  "directional": {
    "color": [
      1.0,
      1.0,
      1.0
    ],
    "enabled": true,
    "lux": 1000.0
  },
  "exposure": {
    "black_influence": 0.0,
    "compensation_ev": 0.0,
    "curve": [],
    "enabled": true,
    "high_percentile": 0.8999999761581421,
    "key": 12.5,
    "log_luminance_range": 25.0,
    "low_percentile": 0.10000000149011612,
    "manual_ev": 8.380765914916992,
    "max_ev": 16.0,
    "metering_mode": 0,
    "min_ev": -6.0,
    "min_log_luminance": -12.0,
    "mode": 2,
    "speed_down": 1.0,
    "speed_up": 3.0,
    "spot_meter_radius": 0.20000000298023224,
    "target_luminance": 0.18000000715255737,
    "transition_distance": 1.5
  },
  "gamma": 2.200000047683716,
  "objects": [
    {
      "enabled": true,
      "position": [
        1.600000023841858,
        0.0,
        1.0
      ],
      "rotation_deg": [
        -180.0,
        0.0,
        0.0
      ],
      "scale": [
        1.0,
        1.0,
        1.0
      ]
    },
    {
      "enabled": true,
      "position": [
        0.0,
        0.0,
        1.0
      ],
      "rotation_deg": [
        -180.0,
        0.0,
        0.0
      ],
      "scale": [
        1.0,
        1.0,
        1.0
      ]
    },
    {
      "enabled": true,
      "position": [
        -1.600000023841858,
        0.0,
        1.0
      ],
      "rotation_deg": [
        -180.0,
        0.0,
        0.0
      ],
      "scale": [
        1.0,
        1.0,
        1.0
      ]
    },
    {
      "enabled": true,
      "position": [
        -1.0,
        2.0,
        1.0
      ],
      "rotation_deg": [
        0.0,
        0.0,
        0.0
      ],
      "scale": [
        1.0,
        1.0,
        1.0
      ]
    },
    {
      "enabled": true,
      "position": [
        1.0,
        2.0,
        1.0
      ],
      "rotation_deg": [
        0.0,
        0.0,
        0.0
      ],
      "scale": [
        1.0,
        1.0,
        1.0
      ]
    },
    {
      "enabled": true,
      "position": [
        0.0,
        0.0,
        0.0
      ],
      "rotation_deg": [
        0.0,
        0.0,
        0.0
      ],
      "scale": [
        8.0,
        8.0,
        1.0
      ]
    }
  ],
  "point": {
    "color": [
      1.0,
      1.0,
      1.0
    ],
    "enabled": true,
    "flux_lm": 50.0,
    "position": [
      -3.0,
      3.0,
      3.0
    ],
    "radius_m": 0.0,
    "range_m": 15.0
  },
  "spot": {
    "color": [
      0.6439024209976196,
      0.12249850481748581,
      0.12249850481748581
    ],
    "direction": [
      0.0,
      1.0,
      -1.0
    ],
    "enabled": true,
    "flux_lm": 80.0,
    "inner_degrees": 20.0,
    "outer_degrees": 30.0,
    "position": [
      3.0,
      -3.0,
      3.0
    ],
    "radius_m": 0.0,
    "range_m": 20.0
  },
  "tone_mapper": 0,
  "version": 1
}
